{
  "conversation_id": "route-v4-test-02-new-project-new-archive",
  "conversation_title": "Route V4 Test 2 - new project and new archive",
  "project": "Route V4 Alpha",
  "extraction_type": "conversation",
  "start_time": "2026-08-06T18:20:00+02:00",
  "end_time": "2026-08-06T18:25:00+02:00",
  "message_count": 1,
  "messages": [
    {
      "role": "user",
      "content": "Manual archive_conversation route V4 regression test 2."
    }
  ],
  "source": "chat",
  "source_platform": "chatgpt",
  "priority": "highNormalHigh"
}