{
  "conversation_id": "route-v4-test-06-missing-project-matching-archive",
  "conversation_title": "Route V4 Test 6 - project recreated and archive updated",
  "project": "Route V4 Gamma",
  "extraction_type": "conversation",
  "start_time": "2026-08-06T18:46:00+02:00",
  "end_time": "2026-08-06T18:51:00+02:00",
  "message_count": 1,
  "messages": [
    {
      "role": "user",
      "content": "Route V4 regression test 6 content after recreating the matching project."
    }
  ],
  "summary": "Regression test 6 verifies that a missing Gamma project is recreated and relinked when the stored and requested project keys match.",
  "source": "chat",
  "source_platform": "chatgpt",
  "priority": "high"
}